id,_id,context,core,dateupload,farm,iconfarm,iconserver,in_park,labels,owner,ownername,parkunit,secret,server,tags,title,views,latitude,longitude
31737148918,5f1b850f7547241674906791,0,True,-155,2,3,2766,True,0,47458193@N02,Ike Fitz,katm,bce442e3c0,1933,katmainationalpark brookscamp,looking west from Dumpling Mountain_09092018_3,203,58.578702,-155.867639
31737151198,5f1b850f754724167490678e,0,True,-155,2,3,2766,True,0,47458193@N02,Ike Fitz,katm,c5e859819d,1976,katmainationalpark brookscamp,Lake Brooks seen from Dumpling Mountain_06092018,199,58.572,-155.86143700000005
44695648075,5f1b850f754724167490678c,0,True,-155,2,3,2766,True,0,47458193@N02,Ike Fitz,katm,761a4d797f,1955,katmainationalpark brookscamp,Iliuk Arm and Brooks River area seen from Dumpling Mountain_06092018,218,58.57200200000001,-155.86143700000005
30668499997,5f1b850f7547241674906770,0,True,-155,2,3,2766,True,0,47458193@N02,Ike Fitz,katm,9a90c755cd,1979,katmainationalpark brookscamp,above the clouds on Dumpling Mountain_07012018_6,313,58.571943999999995,-155.861325
31737180198,5f1b850f754724167490677f,0,True,-155,2,3,2766,True,0,47458193@N02,Ike Fitz,katm,1893e1db08,1923,katmainationalpark brookscamp,Dumpling Mountain summit area_7_06092018,199,58.583293999999995,-155.861214
25293162343,5f1b850f7547241674906ed6,0,True,-155,2,3,2766,True,0,47458193@N02,Ike Fitz,katm,90b16d7777,1456,katmainationalparkandpreserve,fall foliage on Dumpling Mountain_02_09072015,206,58.5733,-155.85955900000005
45609423191,5f1b850f7547241674906780,0,True,-155,2,3,2766,True,0,47458193@N02,Ike Fitz,katm,d95ee5c315,1976,katmainationalpark brookscamp,Dumpling Mountain summit area_06092018,202,58.580727,-155.859331
25289162804,5f1b850f7547241674906ed7,0,True,-155,2,3,2766,True,0,47458193@N02,Ike Fitz,katm,401fa65f16,1710,katmainationalparkandpreserve,fall foliage on Dumpling Mountain_06_09072015,205,58.573436,-155.85910900000005
25289157724,5f1b850f7547241674906ed8,0,True,-155,2,3,2766,True,0,47458193@N02,Ike Fitz,katm,d54fca00d0,1512,berry katmainationalparkandpreserve,fall foliage on Dumpling Mountain_11_09072015,210,58.573085999999996,-155.854348
25794090854,5f1b850f7547241674906e72,0,True,-155,2,3,2766,True,0,47458193@N02,Ike Fitz,katm,7f93ef8397,1692,bird wildlife katmai brooksriver brookscamp katmainationalpark,arctic tern on island on Lake Brooks_01_06142015,596,58.536894,-155.847103
25801143752,5f1b850f7547241674906ed2,0,True,-155,2,3,2766,True,0,47458193@N02,Ike Fitz,katm,2223ebdfc0,1658,berry katmainationalparkandpreserve,blueberries on Dumpling Mountain_2_08162015,210,58.571985999999995,-155.845731
25293041463,5f1b850f7547241674906ee2,0,True,-155,2,3,2766,True,0,47458193@N02,Ike Fitz,katm,fef2048756,1682,katmainationalparkandpreserve,tundra on upper slopes of Dumpling Mountain_1_08222015,155,58.57186899999999,-155.845067
45609421991,5f1b850f7547241674906781,0,True,-155,2,3,2766,True,0,47458193@N02,Ike Fitz,katm,469ac941b7,1964,katmainationalpark brookscamp,Dumpling Mountain Trail_6_07012018,202,58.571852,-155.842123
25289131454,5f1b850f7547241674906edd,0,True,-155,2,3,2766,True,0,47458193@N02,Ike Fitz,katm,a4f9afb534,1548,katmainationalparkandpreserve,looking east and south from upper slopes of Dumpling Mountain Panorama_0822015,169,58.571966,-155.841748
31737167058,5f1b850f7547241674906785,0,True,-155,2,3,2766,True,0,47458193@N02,Ike Fitz,katm,901e2c39af,1948,katmainationalpark brookscamp,"fall colors, Dumpling Mountain_09092018_2",198,58.571911,-155.841689
25826907801,5f1b850f7547241674906ed9,0,True,-155,2,3,2766,True,0,47458193@N02,Ike Fitz,katm,4414ba890a,1577,katmainationalparkandpreserve,fall foliage on Dumpling Mountain_32_09072015,210,58.571727,-155.841159
44695656235,5f1b850f7547241674906787,0,True,-155,2,3,2766,True,0,47458193@N02,Ike Fitz,katm,36b840d842,1946,katmainationalpark brookscamp,"fog bow, Dumpling Mountain_09092018_10",293,58.570766000000006,-155.831173
45609412271,5f1b850f7547241674906786,0,True,-155,2,3,2766,True,0,47458193@N02,Ike Fitz,katm,95ffe2f0e4,1901,katmainationalpark brookscamp,"fog bow, Dumpling Mountain_09092018_7",195,58.570752,-155.83094499999999
45609419421,5f1b850f7547241674906782,0,True,-155,2,3,2766,True,0,47458193@N02,Ike Fitz,katm,69554753c1,1961,katmainationalpark brookscamp,Dumpling Mountain_06252018,205,58.57073000000001,-155.830242
36007861395,5f1b850f7547241674906916,0,True,-155,5,8,7252,True,0,72063229@N00,jpmckenna - Plotting 2020 Adventures,katm,d96ef21dc8,4320,,2017 Day 189 - Hiking Dumpling Mountain,128,58.57055500000001,-155.829723
25921905575,5f1b850f7547241674906ed1,0,True,-155,2,3,2766,True,0,47458193@N02,Ike Fitz,katm,5bdec50713,1557,katmainationalparkandpreserve,bear trail on Dumpling Mountain_3_06062015,851,58.587371999999995,-155.828592
10106317146,5f1b850f75472416749071df,0,True,-155,8,0,0,True,0,78904630@N08,Christoph Strässler,katm,2c4593edf5,7298,usa alaska 169 brookslake brookscamp katmainationalpark alaska2013 dumplingmountaintrail,"View from Dumpling Mountain Trail, Katmai National Park",1527,58.569166,-155.824333
6156683623,5f1b850f754724167490738d,0,True,-155,7,4,3831,True,0,82199457@N00,t i g,katm,b692ee2ae2,6178,alaska fishing aviation beaver flyfishing brooks arl,ARL 2011,119,58.543482999999995,-155.82370600000004
7625926990,5f1b850f75472416749072bb,0,True,-155,9,6,5467,True,0,52494799@N00,valeski,katm,d4ea58d1be,8013,,Floatplane Crew,34,58.548373,-155.819349
7625926682,5f1b850f75472416749072bc,0,True,-155,9,6,5467,True,0,52494799@N00,valeski,katm,652a54020f,8001,,Beach,25,58.548373,-155.819349
7625926136,5f1b850f75472416749072bd,0,True,-155,9,6,5467,True,0,52494799@N00,valeski,katm,16739d891a,8430,,Dominant Male,59,58.548373,-155.819349
7625925538,5f1b850f75472416749072be,0,True,-155,9,6,5467,True,0,52494799@N00,valeski,katm,ba19b9e6c0,8159,,Yea! I caught it!,22,58.548373,-155.819349
7625915810,5f1b850f75472416749072bf,0,True,-155,9,6,5467,True,0,52494799@N00,valeski,katm,d36f36e20e,8142,,Snap!,23,58.548373,-155.819349
7625915422,5f1b850f75472416749072c0,0,True,-155,8,6,5467,True,0,52494799@N00,valeski,katm,e89716e918,7119,salmon,Skinning,37,58.548373,-155.819349
7625915052,5f1b850f75472416749072c1,0,True,-155,9,6,5467,True,0,52494799@N00,valeski,katm,fed62c423c,8150,salmon,Catch,75,58.548373,-155.819349
7625914546,5f1b850f75472416749072c2,0,True,-155,8,6,5467,True,0,52494799@N00,valeski,katm,ddaa6b68bf,7140,salmon brownbear,Salmon Jump (So Close!),411,58.548373,-155.819349
7625914198,5f1b850f75472416749072c3,0,True,-155,9,6,5467,True,0,52494799@N00,valeski,katm,3ee7b75d9d,8421,,Bounding (miss),40,58.548373,-155.819349
7625913738,5f1b850f75472416749072c4,0,True,-155,8,6,5467,True,0,52494799@N00,valeski,katm,513a1f2108,7124,,Perched,25,58.548373,-155.819349
7625912654,5f1b850f75472416749072c5,0,True,-155,9,6,5467,True,0,52494799@N00,valeski,katm,933fe87d01,8027,,Setting up,23,58.548373,-155.819349
7625912244,5f1b850f75472416749072c6,0,True,-155,8,6,5467,True,0,52494799@N00,valeski,katm,e7c7795ebe,7118,,Relaxing meal,23,58.548373,-155.819349
7625911882,5f1b850f75472416749072c7,0,True,-155,9,6,5467,True,0,52494799@N00,valeski,katm,cfa7425127,8426,,Teeth,25,58.548373,-155.819349
7625906032,5f1b850f75472416749072c8,0,True,-155,9,6,5467,True,0,52494799@N00,valeski,katm,61ceaf67c8,8155,,Youth,32,58.548373,-155.819349
6588682017,5f1b850f754724167490732e,0,True,-155,8,3,2766,True,0,47458193@N02,Ike Fitz,katm,9dbc13d09b,7035,katmainationalparkandpreserve,brooks river from Dumpling Mtn. Tral,486,58.571346999999996,-155.80775
10106308676,5f1b850f75472416749071e0,0,True,-155,8,0,0,True,0,78904630@N08,Christoph Strässler,katm,24410c7327,7335,usa alaska 169 brookscamp katmainationalpark alaska2013 dumplingmountaintrail,"View from Dumpling Mountain Trail, Katmai National Park",1825,58.56966600000001,-155.80766599999995
24754609997,5f1b850f75472416749068ec,0,True,-155,5,5,4743,True,0,158661726@N06,Mike4Trees,katm,c81ea3349b,4674,greenalder alder tree trees,female flowers_3 Alnus viridis,21,58.571022,-155.80541200000005
44695645885,5f1b850f754724167490678d,0,True,-155,2,3,2766,True,0,47458193@N02,Ike Fitz,katm,69654cefc6,1972,katmainationalpark brookscamp,Lake Brooks seen from Dumpling Mountain trail_06092018,205,58.569238,-155.799373
25801139522,5f1b850f7547241674906ed3,0,True,-155,2,3,2766,True,0,47458193@N02,Ike Fitz,katm,1353a1c0d2,1590,katmainationalparkandpreserve,Brooks River_07072015,209,58.56904399999999,-155.798948
31737143108,5f1b850f754724167490670b,0,True,-155,2,3,2766,True,0,47458193@N02,Ike Fitz,katm,f62fe1196b,1951,katmainationalpark brookscamp brooks river,Naknek Lake and Iliuk Arm seen from Dumpling Mountain Overlook_06092018,298,58.56898,-155.798673
35334334450,5f1b850f75472416749069b8,0,True,-155,5,4,3353,True,0,39333584@N03,favonius81,katm,74b2a2e88d,4070,katmainationalpark alaska usa us,Alaska2016,115,58.569038,-155.798653
48492219036,5f1b850f7547241674906728,0,True,-155,66,8,7746,True,0,116488457@N08,megansnyder3,katm,57f8048929,65535,,IMG_3094,67,58.568996999999996,-155.7986
35552576122,5f1b850f75472416749069b9,0,True,-155,5,4,3353,True,0,39333584@N03,favonius81,katm,e66e2b7685,4018,katmainationalpark alaska usa us,Alaska2016,104,58.56904399999999,-155.798589
35334329530,5f1b850f75472416749069ba,0,True,-155,5,4,3353,True,0,39333584@N03,favonius81,katm,46c61b3543,4112,katmainationalpark alaska usa us,Alaska2016,65,58.569038,-155.798581
31737181828,5f1b850f754724167490677e,0,True,-155,2,3,2766,True,0,47458193@N02,Ike Fitz,katm,e831d0e75e,1938,katmainationalpark brookscamp,"Drosera anglica, english sundew_2_06062018",193,58.54918000000001,-155.798306
44695642505,5f1b850f754724167490678f,0,True,-155,2,3,2766,True,0,47458193@N02,Ike Fitz,katm,fe346cb10b,1938,katmainationalpark brookscamp,large bog near head of Brooks River_06062018,204,58.54919399999999,-155.798284
48443437377,5f1b850f7547241674906733,0,True,-155,66,6,5468,True,0,58839349@N02,Tom Fenske Photography,katm,2973250365,65535,dumpling katmai brookscamp brooksfalls alaska hiking bears fireweed summer naknek lakebrooks brooksriver,Katmai National Park,1141,58.56889399999999,-155.797989
25826799321,5f1b850f7547241674906ee3,0,True,-155,2,3,2766,True,0,47458193@N02,Ike Fitz,katm,02b5bb9908,1636,katmainationalparkandpreserve,upper Brooks River_2_05312015,160,58.54988,-155.796817
6156675393,5f1b850f7547241674907396,0,True,-155,7,4,3831,True,0,82199457@N00,t i g,katm,d20589e1de,6083,alaska fishing flyfishing arl alaskarainbowlodge,Roll Cast,182,58.548593999999994,-155.79672
48492383487,5f1b850f7547241674906729,0,True,-155,66,8,7746,True,0,116488457@N08,megansnyder3,katm,f4b1f20bf9,65535,,IMG_3099,19,58.56890799999999,-155.79669199999995
48492222286,5f1b850f7547241674906727,0,True,-155,66,8,7746,True,0,116488457@N08,megansnyder3,katm,1595df5fe0,65535,,IMG_3087,29,58.569202000000004,-155.79576200000002
49996132798,5f1b850f75472416749065fe,0,True,-155,66,6,5565,True,0,14723335@N05,thor_mark ,katm,af44fdc0cb,65535,alaska2019 alaskapeninsularanges alaskayukonranges aleutianranges autumncolors autumnleafcolors autumnleaves azimuth108 brookscamp canvas chamerionangustifolium cloudy day14 dumplingmountaintrail dxophotolab3edited eccezionale epilobiumangustifolium fireweedplants freeversepoetry hiketodumplingmountain hillsideoftrees imagecapturewitharsenal katmai katmainationalparkpreserve katmainationalparkandpreserve lake landscape landscapescenery lookingese mostlycloudy mountkatolinat mountlagorce mountainpeak mountains mountainsindistance mountainsoffindistance mountainside nakneklake nature nikond800e nopeople outside partlycloudy poemsused poetryandprose portfolio project365 redcolors ridgelines ridges rollinghillsides scenicsnature trees witharsenal alaska unitedstates,I Will Not Be Afraid Going Out to Explore Nature (Katmai National Park & Preserve),910,58.56925,-155.7957
48492225711,5f1b850f7547241674906726,0,True,-155,66,8,7746,True,0,116488457@N08,megansnyder3,katm,5be97fb433,65535,,IMG_3085,38,58.56924100000001,-155.79568700000004
25895837436,5f1b850f7547241674906ee4,0,True,-155,2,3,2766,True,0,47458193@N02,Ike Fitz,katm,41430b3f76,1475,katmainationalparkandpreserve,upper Brooks River_3_05312015,155,58.551171999999994,-155.795614
31737130908,5f1b850f7547241674906716,0,True,-155,2,3,2766,True,0,47458193@N02,Ike Fitz,katm,9a74554018,1962,katmainationalpark brookscamp brooksriver,upper Brooks River_06082018,316,58.550802000000004,-155.795342
6156683237,5f1b850f754724167490738e,0,True,-155,7,4,3831,True,0,82199457@N00,t i g,katm,4323c55b74,6158,alaska fishing flyfishing brooks arl,ARL 2011,126,58.558263000000004,-155.795323
43791795810,5f1b850f7547241674906710,0,True,-155,2,3,2766,True,0,47458193@N02,Ike Fitz,katm,b9dcf6908d,1977,katmainationalpark brookscamp brooksriver,outlet of Lake Brooks and head of Brooks River_2_06062018,279,58.547561,-155.795117
31737139628,5f1b850f754724167490670f,0,True,-155,2,3,2766,True,0,47458193@N02,Ike Fitz,katm,eee0742b97,1978,katmainationalpark brookscamp brooksriver,old trapper cabin near head of Brooks River_06082018,308,58.548775,-155.794453
35334267000,5f1b850f75472416749069ce,0,True,-155,5,4,3353,True,0,39333584@N03,favonius81,katm,b23b0c4862,4253,katmainationalpark alaska usa us,Alaska2016,62,58.546896999999994,-155.794287
45609417831,5f1b850f7547241674906783,0,True,-155,2,3,2766,True,0,47458193@N02,Ike Fitz,katm,0bfee92e93,1939,katmainationalpark brookscamp,dusk at Lake Brooks_09122018_2,205,58.547027,-155.794245
26373072016,5f1b850f7547241674906e67,0,True,-155,2,3,2766,True,0,47458193@N02,Ike Fitz,katm,d27b31cd0a,1529,bear wildlife brownbear ursusarctos katmai brooksriver brookscamp katmainationalpark,854 Divot fishing at the head of Brooks River_03_09062015,653,58.546344,-155.793787
25921887775,5f1b850f7547241674906ed4,0,True,-155,2,3,2766,True,0,47458193@N02,Ike Fitz,katm,46982abb0d,1506,katmainationalparkandpreserve,Dumpling Mountain and Brooks River Panorama_1_09122015,177,58.546518999999996,-155.79369499999999
49950655282,5f1b850f754724167490660d,0,True,-155,66,6,5565,True,0,14723335@N05,thor_mark ,katm,f0ee350c72,65535,airplane alaska2019 alaskapeninsularanges alaskayukonranges aleutianranges azimuth268 brooks brookslake canvas cloudy day13 dxophotolab3edited floatplane imagecapturewitharsenal katmai katmainationalparkpreserve katmainationalparkandpreserve lake lakebrooks landscape landscapescenery lookingwest mostlycloudy mountainpeak mountains mountainsindistance mountainsoffindistance mountainside nature nikond800e nopeople outside partlycloudy portfolio project365 scenicsnature seaplane sunny trees witharsenal alaska unitedstates,They Got Off Their Plane and Headed off to Fish (Katmai National Park & Preserve),822,58.54635,-155.79353400000005
6157225936,5f1b850f754724167490738c,0,True,-155,7,4,3831,True,0,82199457@N00,t i g,katm,c12b425ee3,6186,alaska fishing aviation beaver flyfishing brooks arl,ARL 2011,117,58.546036,-155.793509
6156688517,5f1b850f7547241674907382,0,True,-155,7,4,3831,True,0,82199457@N00,t i g,katm,841a947138,6194,alaska fishing aviation beaver flyfishing brooks arl,ARL 2011,112,58.546046999999994,-155.793456
6985776549,5f1b850f75472416749072f9,0,True,-155,8,4,3831,True,0,45955091@N06,Madonna Martin Photography,katm,45a5df390f,7193,animals alaska bears,old bear Cinnamon close-up,329,58.555023,-155.792527
10106257945,5f1b850f75472416749071e1,0,True,-155,3,0,0,True,0,78904630@N08,Christoph Strässler,katm,c7afe6dd46,2869,usa alaska 169 brookscamp katmainationalpark nakneklake alaska2013 dumplingmountaintrail,"Brooks Camp and Naknek Lake, Katmai National Park",1120,58.56816600000001,-155.7925
19115302033,5f1b850f7547241674906fdf,0,True,-155,1,0,0,True,0,14516886@N07,tappancs60,katm,8e9698db02,312,bear alaska katmai,Lush vegetation,36,58.552863,-155.79235500000001
31737134548,5f1b850f7547241674906715,0,True,-155,2,3,2766,True,0,47458193@N02,Ike Fitz,katm,8d13470b92,1915,katmainationalpark brookscamp brooksriver,terrace south of Brooks Falls_06082018,306,58.554338,-155.792323
10142029936,5f1b850f7547241674907115,0,True,-155,8,0,0,True,0,78904630@N08,Christoph Strässler,katm,5fb5a76f3c,7378,usa alaska 169 braunbär lachs brookscamp katmainationalpark alaska2013,Fishing Brown Bear at Brooks Falls,636,58.555246999999994,-155.792312
10141977213,5f1b850f7547241674907116,0,True,-155,4,0,0,True,0,78904630@N08,Christoph Strässler,katm,620909abff,3806,usa alaska 169 braunbär lachs brookscamp katmainationalpark alaska2013,Brown Bear with captured Salmon,1697,58.555246999999994,-155.792312
10106345424,5f1b850f7547241674907117,0,True,-155,4,0,0,True,0,78904630@N08,Christoph Strässler,katm,5947ede17a,3721,usa alaska 169 weisskopfseeadler brookscamp katmainationalpark tierwelt alaska2013,"Bald Eagle, Katmai National Park",1903,58.555246999999994,-155.792312
10144585346,5f1b850f75472416749071b0,0,True,-155,6,0,0,True,0,78904630@N08,Christoph Strässler,katm,846f7f6283,5483,,Bear catching Salmon,528,58.555246999999994,-155.792312
10143760964,5f1b850f75472416749071b1,0,True,-155,8,0,0,True,0,78904630@N08,Christoph Strässler,katm,a735aa45cd,7436,,Bear eating a Salmon,581,58.555246999999994,-155.792312
10143793806,5f1b850f75472416749071b2,0,True,-155,8,0,0,True,0,78904630@N08,Christoph Strässler,katm,ae9a1d0f50,7377,,Brown Bear at Brooks Falls,784,58.555246999999994,-155.792312
10141902404,5f1b850f75472416749071c6,0,True,-155,6,0,0,True,0,78904630@N08,Christoph Strässler,katm,74e2f7d758,5543,usa alaska 169 braunbär brookscamp katmainationalpark alaska2013,Fighting Brown Bears,2561,58.555246999999994,-155.792312
10142077576,5f1b850f75472416749071c7,0,True,-155,3,0,0,True,0,78904630@N08,Christoph Strässler,katm,553db34a60,2844,usa alaska 169 braunbär lachs brookscamp katmainationalpark alaska2013,Brown Bear catching Salmon,1337,58.555246999999994,-155.792312
10142109363,5f1b850f75472416749071c8,0,True,-155,6,0,0,True,0,78904630@N08,Christoph Strässler,katm,6b74846a33,5466,usa alaska 169 braunbär lachs brookscamp katmainationalpark alaska2013,Brown Bear fishing Salmon,1913,58.555246999999994,-155.792312
10141981365,5f1b850f75472416749071c9,0,True,-155,4,0,0,True,0,78904630@N08,Christoph Strässler,katm,954998c600,3816,usa alaska 169 braunbär lachs brookscamp katmainationalpark alaska2013,Brown Bear catching Salmon,1325,58.555246999999994,-155.792312
10142054256,5f1b850f75472416749071ca,0,True,-155,8,0,0,True,0,78904630@N08,Christoph Strässler,katm,3c409b7289,7349,usa alaska 169 braunbär lachs brookscamp katmainationalpark alaska2013,Brown Bear catching Salmon,1529,58.555246999999994,-155.792312
10141864774,5f1b850f75472416749071cb,0,True,-155,3,0,0,True,0,78904630@N08,Christoph Strässler,katm,7cd8e553ab,2891,usa alaska 169 braunbär lachs brookscamp katmainationalpark alaska2013,Brown Bear catching Salmon,1501,58.555246999999994,-155.792312
10142078993,5f1b850f75472416749071cc,0,True,-155,6,0,0,True,0,78904630@N08,Christoph Strässler,katm,19400062dd,5340,usa alaska 169 braunbär lachs brookscamp katmainationalpark alaska2013,Brown Bear catching Salmon,1574,58.555246999999994,-155.792312
10142017736,5f1b850f75472416749071cd,0,True,-155,4,0,0,True,0,78904630@N08,Christoph Strässler,katm,7024b4c735,3798,usa alaska 169 braunbär lachs brookscamp katmainationalpark alaska2013,Brown Bear fishing Salmon,2002,58.555246999999994,-155.792312
10142050323,5f1b850f75472416749071ce,0,True,-155,8,0,0,True,0,78904630@N08,Christoph Strässler,katm,cb4bc300a1,7325,usa alaska 169 braunbär lachs brookscamp katmainationalpark alaska2013,Brown Bears fishing Salmon,843,58.555246999999994,-155.792312
10142003396,5f1b850f75472416749071cf,0,True,-155,3,0,0,True,0,78904630@N08,Christoph Strässler,katm,ed57d121c6,2886,usa alaska 169 braunbär brookscamp katmainationalpark alaska2013,Brown Bear at Brook Falls,655,58.555246999999994,-155.792312
10142035383,5f1b850f75472416749071d0,0,True,-155,6,0,0,True,0,78904630@N08,Christoph Strässler,katm,f8dc6d3995,5514,usa alaska 169 braunbär lachs brookscamp katmainationalpark alaska2013,Brown Bears at Brooks Falls,751,58.555246999999994,-155.792312
10141902385,5f1b850f75472416749071d1,0,True,-155,4,0,0,True,0,78904630@N08,Christoph Strässler,katm,1d4b7004a0,3706,usa alaska 169 braunbär brookscamp katmainationalpark alaska2013,Brown Bear at Brook Falls,547,58.555246999999994,-155.792312
10141895155,5f1b850f75472416749071d2,0,True,-155,4,0,0,True,0,78904630@N08,Christoph Strässler,katm,effe1952f2,3813,usa alaska 169 braunbär lachs brookscamp katmainationalpark alaska2013,Brown Bear eating Salmon,1442,58.555246999999994,-155.792312
10141784664,5f1b850f75472416749071d3,0,True,-155,8,0,0,True,0,78904630@N08,Christoph Strässler,katm,52dc02c964,7382,usa alaska 169 braunbär lachs brookscamp katmainationalpark alaska2013,Brown Bear with captured Salmon,1227,58.555246999999994,-155.792312
10141779444,5f1b850f75472416749071d4,0,True,-155,8,0,0,True,0,78904630@N08,Christoph Strässler,katm,cd94f1844a,7338,usa alaska 169 braunbär brookscamp katmainationalpark alaska2013,Brown Bears at Brooks Falls,546,58.555246999999994,-155.792312
10141773254,5f1b850f75472416749071d5,0,True,-155,4,0,0,True,0,78904630@N08,Christoph Strässler,katm,7640ef0945,3754,usa alaska 169 braunbär lachs brookscamp katmainationalpark alaska2013,Brown Bear eating Salmon,1428,58.555246999999994,-155.792312
10141991453,5f1b850f75472416749071d6,0,True,-155,3,0,0,True,0,78904630@N08,Christoph Strässler,katm,02911005ed,2819,usa alaska 169 braunbär brookscamp katmainationalpark alaska2013,Fishing Brown Bear,698,58.555246999999994,-155.792312
10141983933,5f1b850f75472416749071d7,0,True,-155,8,0,0,True,0,78904630@N08,Christoph Strässler,katm,f12f66f769,7368,usa alaska 169 braunbär lachs brookscamp katmainationalpark alaska2013,Brown Bear eating Salmon,1569,58.555246999999994,-155.792312
10141966263,5f1b850f75472416749071d8,0,True,-155,3,0,0,True,0,78904630@N08,Christoph Strässler,katm,8289ecf62e,2839,usa alaska 169 braunbär brookscamp katmainationalpark alaska2013,Brown Bear at Brook Falls,1625,58.555246999999994,-155.792312
10141960713,5f1b850f75472416749071d9,0,True,-155,3,0,0,True,0,78904630@N08,Christoph Strässler,katm,a461c4aaed,2864,usa alaska 169 braunbär brookscamp katmainationalpark alaska2013,Brown Bear at Brook Falls,915,58.555246999999994,-155.792312
10141831955,5f1b850f75472416749071da,0,True,-155,6,0,0,True,0,78904630@N08,Christoph Strässler,katm,66efb96e6e,5475,usa alaska 169 braunbär brookscamp katmainationalpark alaska2013,Brown Bear,1337,58.555246999999994,-155.792312
10106388855,5f1b850f75472416749071de,0,True,-155,6,0,0,True,0,78904630@N08,Christoph Strässler,katm,18b997b5b6,5549,usa alaska 169 weisskopfseeadler brookscamp katmainationalpark tierwelt alaska2013,"Bald Eagle, Katmai National Park",1320,58.555246999999994,-155.792312
30825182192,5f1b850f7547241674906a27,0,True,-155,6,3,2766,True,0,47458193@N02,Ike Fitz,katm,b658e9091d,5635,wildlife bears brooksriver brookscamp katmainationalpark brooksfalls cubs cub,402 and yearlings_9_07092016,658,58.55495,-155.79226200000005
4243289445,5f1b850f75472416749075fb,0,True,-155,3,3,2342,True,0,21008431@N04,Howlsthunder,katm,2d962ea42c,2741,bears cubs brownbear katmai,100_2955,158,58.555429000000004,-155.792226
4244056568,5f1b850f75472416749075fc,0,True,-155,5,3,2342,True,0,21008431@N04,Howlsthunder,katm,fe168dd464,4010,bears brownbear katmai,100_2775,185,58.555429000000004,-155.792226
4244055576,5f1b850f75472416749075fd,0,True,-155,5,3,2342,True,0,21008431@N04,Howlsthunder,katm,3f7901e265,4059,bears brownbear katmai,100_2774,208,58.555429000000004,-155.792226
4244054790,5f1b850f75472416749075fe,0,True,-155,5,3,2342,True,0,21008431@N04,Howlsthunder,katm,7b1a3a9edf,4025,bears brownbear katmai,100_2771,256,58.555429000000004,-155.792226
4243279115,5f1b850f75472416749075ff,0,True,-155,5,3,2342,True,0,21008431@N04,Howlsthunder,katm,3ac6048a46,4008,bears brownbear katmai,100_2767,201,58.555429000000004,-155.792226
4243275729,5f1b850f7547241674907600,0,True,-155,5,3,2342,True,0,21008431@N04,Howlsthunder,katm,86706eece5,4065,bears brownbear katmai,100_2766,177,58.555429000000004,-155.792226
4244048152,5f1b850f7547241674907601,0,True,-155,5,3,2342,True,0,21008431@N04,Howlsthunder,katm,0908af2b64,4006,bears brownbear katmai,100_2765,181,58.555429000000004,-155.792226
4244046936,5f1b850f7547241674907602,0,True,-155,5,3,2342,True,0,21008431@N04,Howlsthunder,katm,c08c1249e3,4071,bears brownbear katmai,100_2762,210,58.555429000000004,-155.792226
4243272211,5f1b850f7547241674907603,0,True,-155,5,3,2342,True,0,21008431@N04,Howlsthunder,katm,74abd8891b,4046,bears brownbear katmai,100_2760,225,58.555429000000004,-155.792226
19598755572,5f1b850f7547241674906ffc,0,True,-155,1,9,8726,True,0,20478828@N08,jeff_a_goldberg,katm,c52a38ae8c,349,bear alaska us unitedstates grizzly nationalparkservice brownbear grizzlybear brooksfalls katmai brooksriver brookscamp brookslodge katmainationalparkandpreserve,Unconventional Method for Spotting Fish,817,58.554777,-155.792212
26290198142,5f1b850f7547241674906e85,0,True,-155,2,3,2766,True,0,47458193@N02,Ike Fitz,katm,cd22d8af61,1491,bear bears brownbear ursusarctos katmai brooksriver brookscamp katmainationalpark katmainationalparkandpreserve,32 Chunk_4_07132015,941,58.554843999999996,-155.792195
26373041436,5f1b850f7547241674906e6e,0,True,-155,2,3,2766,True,0,47458193@N02,Ike Fitz,katm,e651fd47da,1542,bear wildlife brownbear ursusarctos katmai brooksriver brookscamp katmainationalpark,868_4_07132015,642,58.554538,-155.792153
30824089052,5f1b850f7547241674906a37,0,True,-155,6,3,2766,True,0,47458193@N02,Ike Fitz,katm,0657a0f19e,5798,wildlife bears brooksriver brookscamp katmainationalpark brooksfalls salmon sockeyesalmon,634 steals from 83 (left)_07072016,619,58.554855,-155.79213700000003
35561641580,5f1b850f754724167490691b,0,True,-155,5,3,2766,True,0,47458193@N02,Ike Fitz,katm,db1bcb594b,4309,bears brownbear brooksriver brooksfalls brookscamp katmainationalpark katmai,856_4_07042015,526,58.554621999999995,-155.79210600000005
